Title,Abstract,Authors,Journal,DOI
Restrictive cardiomyopathy and pseudoxanthoma elasticum skin lesions.,": We report a rare case of a patient with AL amyloidosis and pseudoxanthoma elasticum skin lesions. An association between these two diseases has been previously described as amyloid elastosis in only six cases, but cardiac findings were not fully elucidated. The peculiarity of our case is that a severe cardiac involvement influenced the prognosis negatively. Furthermore, the electron microscopic examination did not show all the peculiar histopathological findings of amyloid elastosis, precluding a final diagnosis of this disease.","Musumeci MB, Semprini L, Casenghi M, Montesanti D, Mastromarino V, Socciarelli F, Volpe M, Autore C",J Cardiovasc Med (Hagerstown). 2016 Dec;17 Suppl 2:e193-e195. doi: 10.2459/JCM.0000000000000158.,10.2459/JCM.0000000000000158 [doi]
Chest Pain and a Very Abnormal Stress Echocardiogram.,No abstract available,"Reddy P, Birkenbach M, Shenoy C",Circulation. 2018 Oct 23;138(17):1899-1903. doi: 10.1161/CIRCULATIONAHA.118.033885.,10.1161/CIRCULATIONAHA.118.033885 [doi]
Left ventricular posterior wall thickness independently predicts the possibility of light-chain cardiac amyloidosis in hospitalized heart failure patients with monoclonal gammopathies.,"BACKGROUND: Early screening for cardiac light-chain amyloidosis (CA-AL) remains a diagnostic challenge due to its nonspecific clinical features. This study aimed to assess whether the results of routine cardiology examinations could predict CA-AL in hospitalized heart failure patients with monoclonal gammopathies. METHODS: After strict filtering, 187 consecutive patients with heart failure and comorbid monoclonal gammopathy were prospectively enrolled from the Department of Cardiology. All patients were referred to the hematologists for further evaluation of suspected cardiac amyloidosis. The cohort consisted of 127 patients with CA-AL, 34 with multiple myeloma (MM), and 26 with monoclonal gammopathy of undetermined significance (MGUS). Comprehensive laboratory and imaging data were systematically collected for each patient. RESULTS: Our results indicated that CA-AL patients exhibited significantly lower left ventricular ejection fractions (EF), proteinuria, and serum creatinine levels, as well as substantially higher cardiac troponin T (cTn-T), free-light chain (FLC) λ, and displayed differences in serum free-light chain (dFLC) levels compared to MM patients. Compared with MM and MGUS patients, CA-AL patients showed consistently increased thicknesses of the interventricular septum and left ventricular posterior wall (LVPW). Univariate and bidirectional logistic regression analysis revealed that thicker LVPW and higher dFLC were significant risk factors for CA-AL. Receiver operating characteristic (ROC) curve analysis demonstrated that the LVPW thickness [area under the curve (AUC) = 0.798, 95% confidence interval (CI) 0.728-0.868] yielded a better AUC than dFLC (AUC = 0.661, 95% CI 0.569-0.754), and combining LVPW with dFLC did not significantly increase diagnostic outcome as compared with LVPW alone. CONCLUSIONS: These findings suggest that LVPW thickness effectively predicts CA-AL in hospitalized heart failure patients with monoclonal gammopathies, thereby providing valuable insights into the diagnostic process for CA-AL.","Yu B, Zhao W, Wei Z, Liu P",Cardiol J. 2026;33:e00226034. doi: 10.5603/cj.104037.,VM/OJS/J/104037 [pii]
Echocardiographic Nomogram Model: A Tool for Assessing Cardiac Involvement in Patients With Systemic Amyloidosis.,"OBJECTIVES: Cardiac involvement is significantly relevant to a poor prognosis in patients with systemic amyloidosis, often leading to adverse outcomes. The objective of this study was to develop a diagnostic model for cardiac amyloidosis (CA) in primary light chain amyloidosis (pAL) to facilitate early detection and improve prognostic evaluation. METHODS: In this retrospective study involving 72 patients with primary pAL amyloidosis (51 with cardiac involvement), we systematically employed cardiac magnetic resonance imaging (CMR) for cardiac assessment. CA diagnosis was confirmed histologically via noncardiac tissue biopsy, positive for light chain systemic amyloidosis. To dissect the risk factors for cardiac involvement, we applied both univariate logistic regression and a random forest algorithm. Subsequently, the findings from these analyses informed the construction of a predictive nomogram. We rigorously evaluated the nomogram's performance using receiver operating characteristic curve analysis, calibration curve assessment, and decision curve analysis. RESULTS: The nomogram model included relative wall thickness (RWT), the ratio of mitral peak flow velocity in early diastolic (E wave) to the pulsed tissue Doppler imaging-derived early diastolic peak velocity (e' wave) at the interventricular septal mitral annulus (E/e' sep), ejection fraction to peak systolic global longitudinal strain ratio (EFSR) and right ventricular fractional area change (RV FAC). The model exhibited good diagnostic performance, with an area under the ROC curve of 0.85 (95% CI, 0.75-0.92), a sensitivity of 80.4% (95% CI, 66.9%-90.2%), and a specificity of 85.7% (95% CI, 63.7%-97.0%). CONCLUSIONS: The nomogram provided a noninvasive and effective means of assessing cardiac involvement in systemic amyloidosis, offering a valuable aid for clinical decision-making and patient management.","Lin Q, Li X, Tan Z, Xu R, Fei H, Chen O",Echocardiography. 2025 Aug;42(8):e70252. doi: 10.1111/echo.70252.,10.1111/echo.70252 [doi]
Differentiation of light chain cardiac amyloidosis and hypertrophic cardiomyopathy by ensemble machine learning-based radiomic analysis of cardiac magnetic resonance.,"BACKGROUND: We aim to assess the diagnosis performance of an ensemble machine learning (ML) based radiomic analysis of multiparametric cardiac magnetic resonance (CMR) to differentiate light chain cardiac amyloidosis (AL-CA) and hypertrophic cardiomyopathy (HCM). METHODS: In the development dataset, we retrospectively collected at Peking Union Medical College Hospital between January 1, 2017, and December 31, 2022, and included 84 patients with AL-CA, 63 patients with HCM, and 34 healthy controls. Radiomics features were extracted from regions of interest in the myocardium on native T1, post-contrast T1, extracellular volume (ECV), and T2 mapping. For each modal data, eight feature selection methods were used to select the top 10 important features; then, seven ML classifiers were trained with the selected features for disease classification, and the best combinations of feature selection and classifiers were chosen by the highest predictive accuracy (ACC). The predictive results of multiple ML classifiers as input to build an ensemble ML model that classified each case (AL-CA, HCM, or controls) using a""soft voting"" scheme. RESULTS: For native T1, post-contrast T1, T2 mapping, ECV, and clinical data, the best combination of feature selection and classifier is MRMR_RF, XGboost_RF, Lasso_ Lasso, Lasso_RF, and ANOVA_ XGboost, respectively. The myocardial texture and the first-order features of native T1, post-contrast T1, and T2 mapping dominated the ensemble ML model and there was only a marginal role for ventricular shape features. In the hold-out testing dataset (37 AL-CA, 21 HCM, and 14 controls), the ensemble ML model exhibited a better diagnostic value with an area under curve of 0.98 for differentiating the 3 groups. CONCLUSION: An ensemble ML model with competitive diagnostic accuracy was proposed to differentiate AL-CA from HCM patients and healthy controls.","Zhang S, Guo Y, Gao Y, Wu M, Zhuang S, Li X, Chen T, Li J, Tian Z, Wang Y, Zhang S",Orphanet J Rare Dis. 2025 Nov 4;20(1):557. doi: 10.1186/s13023-025-03947-2.,10.1186/s13023-025-03947-2 [pii]
Exploiting endogenous and therapy-induced apoptotic vulnerabilities in immunoglobulin light chain amyloidosis with BH3 mimetics.,"Immunoglobulin light chain (AL) amyloidosis is an incurable hematologic disorder typically characterized by the production of amyloidogenic light chains by clonal plasma cells. These light chains misfold and aggregate in healthy tissues as amyloid fibrils, leading to life-threatening multi-organ dysfunction. Here we show that the clonal plasma cells in AL amyloidosis are highly primed to undergo apoptosis and dependent on pro-survival proteins MCL-1 and BCL-2. Notably, this MCL-1 dependency is indirectly targeted by the proteasome inhibitor bortezomib, currently the standard of care for this disease and the related plasma cell disorder multiple myeloma, due to upregulation of pro-apoptotic Noxa and its inhibitory binding to MCL-1. BCL-2 inhibitors sensitize clonal plasma cells to multiple front-line therapies including bortezomib, dexamethasone and lenalidomide. Strikingly, in mice bearing AL amyloidosis cell line xenografts, single agent treatment with the BCL-2 inhibitor ABT-199 (venetoclax) produces deeper remissions than bortezomib and triples median survival. Mass spectrometry-based proteomic analysis reveals rewiring of signaling pathways regulating apoptosis, proliferation and mitochondrial metabolism between isogenic AL amyloidosis and multiple myeloma cells that divergently alter their sensitivity to therapies. These findings provide a roadmap for the use of BH3 mimetics to exploit endogenous and induced apoptotic vulnerabilities in AL amyloidosis.","Fraser CS, Spetz JKE, Qin X, Presser A, Choiniere J, Li C, Yu S, Blevins F, Hata AN, Miller JW, Bradshaw GA, Kalocsay M, Sanchorawala V, Sarosiek S, Sarosiek KA",Nat Commun. 2022 Oct 2;13(1):5789. doi: 10.1038/s41467-022-33461-z.,10.1038/s41467-022-33461-z [pii]
Bio-Adrenomedullin Predicts Death and Major Adverse Cardiovascular Events in Cardiac Amyloidosis: A Cross-Continental Multicenter Study.,"BACKGROUND: Bio-ADM (bioactive adrenomedullin) is a vasoactive peptide hormone that predicts clinical outcomes in heart failure-the main driver of adverse outcomes in cardiac amyloidosis (CA). This prospective observational study sought to assess the prognostic role of bio-ADM in CA. METHODS: Patients with CA were enrolled from amyloid centers in Germany (observation cohort), Japan, and the United States (combined validation cohort). Bio-ADM was quantified using the sphingotest bio-ADM assay. Associations of bio-ADM with all-cause death and major adverse cardiovascular events over 2 years were assessed using Kaplan-Meier and Cox regression analyses. Likelihood ratio chi-square tests for nested models evaluated whether adding bio-ADM improves validated prognostic staging systems. RESULTS: In both the German observation cohort (n=86) and the combined validation cohort from Japan and the United States (n=124), elevated bio-ADM (>29 pg/mL) was associated with more frequent all-cause death and major adverse cardiovascular events. Bio-ADM remained independently associated with impaired overall (P<0.001) and major adverse cardiovascular events-free survival (P<0.001) after adjustment for age, sex, and established prognostic biomarkers in the entire cohort. Adding categorized bio-ADM (>29 pg/mL) significantly improved the prognostic accuracy of the National Amyloidosis Centre (C-index 0.674 to 0.787; P=0.002) and MayoATTR (C-index 0.662 to 0.757; P<0.001) staging systems for cardiac transthyretin amyloidosis. Adding bio-ADM to staging systems for cardiac immunoglobulin light chain amyloidosis yielded no significant changes. CONCLUSIONS: Bio-ADM is a promising prognostic biomarker, especially in cardiac transthyretin amyloidosis, where it improved risk stratification when added to established staging systems. Further research is needed to clarify its role as part of staging systems for cardiac immunoglobulin light chain amyloidosis.","Müller ML, Knebel F, Hahn K, Schulte J, Arlt B, Hartmann O, Moore KMS, Takashio S, Izumiya Y, Mitchell JD, Tsujita K, Landmesser U, Heidecker B",J Am Heart Assoc. 2026 Jan 6;15(1):e043736. doi: 10.1161/JAHA.125.043736. Epub 2025 Dec 23.,JAH370042 [pii]
Prevalence of Positive (99 m)Tc-DPD Scintigraphy as an Indicator of the Prevalence of Wild-type Transthyretin Amyloidosis in the Elderly.,"Senile or wild-type transthyretin (wtTTR) amyloidosis is an age-related disease caused by the deposition of wtTTR amyloid protein. In contrast to light chain amyloidosis, (99 m)Tc-DPD scintigraphy (DPD scan) is a useful diagnostic modality for wtTTR amyloidosis.We retrospectively analyzed patients older than 30 years who underwent DPD scanning for non-cardiac reasons at our hospital between June 2014 and March 2017 (n = 9,581). Transthoracic echocardiography was used to assess left ventricular hypertrophy (LVH), as well as systolic and diastolic function.A positive DPD scan was observed in only six patients (0.06%). All six of these patients were older than 70 years, and they constitute only 0.4% of patients in this age group (6/1652). Among the patients with a positive DPD scan, four showed concentric LVH and two showed a normal wall thickness. With respect to the severity of diastolic dysfunction and pulmonary artery pressure, patients with a positive DPD scan showed the expected E' and pulmonary artery systolic pressure for their age.Even considering the limited sensitivity of a positive DPD scan detecting wtTTR amyloidosis, the incidence of a positive DPD scan in non-cardiac patients indicated that wtTTR amyloid deposition does not seem to be a major cause for age-related diastolic dysfunction, nor does appear to have a high incidence in patients with heart failure with preserved EF in the elderly.","Kim HM, Sohn DW, Paeng JC",Int Heart J. 2019 May 30;60(3):643-647. doi: 10.1536/ihj.18-345. Epub 2019 Apr 25.,10.1536/ihj.18-345 [doi]
Congophilic Fibrillary Glomerulonephritis: A Case Series.,"RATIONALE & OBJECTIVE: Congo Red positivity with birefringence under polarized light has traditionally permitted classification of organized glomerular deposits as from amyloid or nonamyloid diseases. The absence of congophilia has been used to differentiate fibrillary glomerulonephritis (GN) from amyloidosis. We describe a series of fibrillary GN cases in which the deposits are Congo Red-positive (congophilic fibrillary GN) and discuss the role of DNAJB9 in distinguishing congophilic fibrillary GN from amyloidosis. STUDY DESIGN: Case series. SETTING & PARTICIPANTS: Analysis of the clinicopathologic characteristics of 18 cases of congophilic fibrillary GN. Mass spectrometry was performed and compared with 24 cases of Congo Red-negative fibrillary GN, 145 cases of amyloidosis, and 12 apparently healthy individuals. DNAJB9 immunohistochemistry was obtained for a subset of cases. RESULTS: The proteomic signature of amyloid was not detected using mass spectrometry among cases of congophilic fibrillary GN. DNAJB9, a recently discovered proteomic marker for fibrillary GN, was detected using mass spectrometry in all cases of fibrillary GN regardless of congophilia and was absent in cases of amyloidosis and in healthy individuals. DNAJB9 immunohistochemistry confirmed the mass spectrometry findings. The congophilic fibrillary GN cases included 11 men and 7 women with a mean age at diagnosis of 65 years. Concomitant monoclonal gammopathy, hepatitis C virus infection, malignancy, or autoimmune disease was present in 35%, 22%, 17%, and 11% of patients, respectively. No patient had evidence of extrarenal amyloidosis. Patients presented with proteinuria (100%), nephrotic syndrome (47%), hematuria (78%), and chronic kidney disease (83%). After a mean follow-up of 23 months, 31% of patients progressed to end-stage kidney disease and the remaining 69% had persistently reduced kidney function. LIMITATIONS: Retrospective nature. Blinded pathology evaluations were not performed. CONCLUSIONS: The congophilic properties of organized fibrillary deposits should not be solely relied on in differentiating fibrillary GN from renal amyloidosis. Mass spectrometry and DNAJB9 immunohistochemistry can be useful in making this distinction.","Alexander MP, Dasari S, Vrana JA, Riopel J, Valeri AM, Markowitz GS, Hever A, Bijol V, Larsen CP, Cornell LD, Fidler ME, Said SM, Sethi S, Herrera Hernandez LP, Grande JP, Erickson SB, Fervenza FC, Leung N, Kurtin PJ, Nasr SH",Am J Kidney Dis. 2018 Sep;72(3):325-336. doi: 10.1053/j.ajkd.2018.03.017. Epub 2018 Jun 14.,S0272-6386(18)30604-8 [pii]
Daratumumab for systemic AL amyloidosis: prognostic factors and adverse outcome with nephrotic-range albuminuria.,"Daratumumab has shown promising first results in systemic amyloid light-chain (AL) amyloidosis. We analyzed a consecutive series of 168 patients with advanced AL receiving either daratumumab/dexamethasone (DD, n = 106) or daratumumab/bortezomib/dexamethasone (DVD, n = 62). DD achieved a remission rate (RR) of 64% and a very good hematologic remission (VGHR) rate of 48% after 3 months. Median hematologic event-free survival (hemEFS) was 11.8 months and median overall survival (OS) was 25.6 months. DVD achieved a 66% RR and a 55% VGHR rate. Median hemEFS was 19.1 months and median OS had not been reached. Cardiac organ responses were noted in 22% with DD and 26% with DVD after 6 months. Infectious complications were common (Common Terminology Criteria [CTC] grade 3/4: DD 16%, DVD 18%) and likely related to a high rate of lymphocytopenia (CTC grade 3/4: DD 20%, DVD 17%). On univariable analysis, hyperdiploidy and gain 1q21 conferred an adverse factor for OS and hemEFS with DD, whereas translocation t(11;14) was associated with a better hemEFS. N-terminal prohormone of brain natriuretic peptide >8500 ng/L could not be overcome for survival with each regimen. Multivariable Cox regression analysis revealed plasma cell dyscrasia (difference between serum free light chains [dFLC]) >180 mg/L as an overall strong negative prognostic factor. Additionally, nephrotic-range albuminuria with an albumin-to-creatinine-ratio (ACR) >220 mg/mmol was a significantly adverse factor for hemEFS (hazard ratio, 2.1 and 3.1) with DD and DVD. Daratumumab salvage therapy produced good results and remission rates challenging any therapy in advanced AL. Outcome is adversely influenced by the activity of the underlying plasma cell dyscrasia (dFLC) and nephrotic-range albuminuria (ACR).","Kimmich CR, Terzer T, Benner A, Dittrich T, Veelken K, Carpinteiro A, Hansen T, Goldschmidt H, Seckinger A, Hose D, Jauch A, Wörner S, Beimler J, Müller-Tidow C, Hegenbart U, Schönland SO",Blood. 2020 Apr 30;135(18):1517-1530. doi: 10.1182/blood.2019003633.,S0006-4971(20)62060-2 [pii]
Prognosis of light chain amyloidosis: a multivariable analysis for survival prediction in patients with cardiac involvement proven by endomyocardial biopsy.,"BACKGROUND: Cardiac involvement is a main determinant of mortality in light chain (AL) amyloidosis but data on survival of patients with cardiac AL amyloidosis proven by endomyocardial biopsy (EMB) are sparse. METHODS: This study analysed clinical, laboratory, electrocardiography and echocardiographic parameters for their prognostic value in the assessment of patients with AL amyloidosis and cardiac involvement. Patients with AL amyloidosis who had their first visit to the amyloidosis centre at the University Hospital Heidelberg between 2006 and 2017 (n=1628) were filtered for cardiac involvement proven by EMB. In the final cohort, mortality-associated markers were analysed by univariate and multivariable Cox regression. Cut-off values for each parameter were calculated using the survival time. RESULTS: One-hundred and seventy-four patients could be identified. Median overall survival time was 1.5 years and median follow-up time was 5.2 years. At the end of the investigation period, 115 patients had died. In multivariable analysis, New York Heart Association-functional class >II (HR 1.65; 95% CI 1.09 to 2.50; p=0.019), left ventricular global longitudinal strain (HR 1.12; 95% CI 1.03 to 1.22; p=0.007), left ventricular end-systolic volume (HR 1.02; 95% CI 1.01 to 1.03; p=0.001), systolic pulmonary artery pressure (HR 0.98; 95% CI 0.96 to 0.99; p=0.027), N-terminal pro-B-type natriuretic peptide (HR 1.57; 95% CI 1.17 to 2.11; p=0.003) and difference in free light chains (HR 1.30; 95% CI 1.05 to 1.62; p=0.017) were independently predictive. CONCLUSION: Among all patients with AL amyloidosis those with cardiac involvement represent a high-risk population with limited therapy options. Therefore, accurate risk stratification is necessary to identify cardiac amyloidosis patients with favourable prognosis. Incorporation of modern imaging techniques into existing or newly developed scoring systems is a promising option that might enable the implementation of risk-adapted therapeutic strategies.","Aurich M, Bucur J, Vey JA, Greiner S, Aus dem Siepen F, Hegenbart U, Schönland S, Katus HA, Frey N, Mereles D",Open Heart. 2023 Jul;10(2):e002310. doi: 10.1136/openhrt-2023-002310.,openhrt-2023-002310 [pii]
"Right Ventricular Hypertrophy, Systolic Function, and Disease Severity in Anderson-Fabry Disease: An Echocardiographic Study.","BACKGROUND: Right ventricular (RV) involvement has been described in Anderson-Fabry disease (AFD), especially in patients with established Fabry cardiomyopathy (FC). However, few and controversial data on RV systolic function are available, and there are no specific tissue Doppler studies. METHODS: Detailed echocardiographic examinations were performed in 45 patients with AFD. FC, defined as maximal left ventricular wall thickness ≥ 15 mm, was present in 12. The Mainz Severity Score Index was calculated for each patient. Pulsed tissue Doppler was applied to the RV free wall at the tricuspid annular level and at the septal and lateral corners at the mitral annular level to obtain systolic tissue Doppler velocities (RV S(a), septal S(a), and lateral S(a), respectively). Twelve patients with amyloid light-chain cardiac amyloidosis were studied as a control group. RESULTS: Echocardiography revealed RV hypertrophy (RVH) in 31% of patients with AFD, all but one of whom were male and all of whom had concomitant left ventricular hypertrophy (LVH). All patients with AFD had normal RV fractional area change (47.9 ± 6.5%) and tricuspid annular plane systolic excursion (21.7 ± 3.2 mm) and all but one also had normal RV S(a) (13.2 ± 2.2 cm/sec). RVH positively correlated with indices of LVH (r = 0.8, P = .0001, for all parameters evaluated), as well as with Mainz Severity Score Index (r = 0.70, P = .0001). Septal and lateral S(a) were decreased in almost all patients (means, 7.7 ± 1.8 and 7.9 ± 1.9 cm/sec, respectively), irrespective of the presence of LVH. Compared with control subjects with cardiac amyloidosis, patients with FC showed better indices of RV systolic function (P < .001 for all: tricuspid annular plane systolic excursion, RV fractional area change, and RV S(a)) despite similar RV wall thickness (6.2 ± 1.2 vs 6.9 ± 1.9 mm, P = NS). CONCLUSIONS: RVH is common in patients with AFD and correlates with disease severity and LVH. RVH, however, does not significantly affect RV systolic function. Patients with FC have better RV systolic function compared with those with cardiac amyloidosis with similar levels of RV thickness. The combination of low LV S(a) values and normal RV S(a) values might be helpful in the differential diagnosis of infiltrative heart disease.","Graziani F, Laurito M, Pieroni M, Pennestrì F, Lanza GA, Coluccia V, Camporeale A, Pedicino D, Verrecchia E, Manna R, Crea F",J Am Soc Echocardiogr. 2017 Mar;30(3):282-291. doi: 10.1016/j.echo.2016.11.014. Epub 2017 Jan 6.,S0894-7317(16)30677-0 [pii]
Liver dysfunction as predictor of prognosis in patients with amyloidosis: utility of the Model for End-stage Liver disease (MELD) scoring system.,"Amyloidosis prognosis is often related to the onset of heart failure and a worsening that is concomitant with kidney-liver dysfunction; thus the Model for End-stage Liver disease (MELD) may be an ideal instrument to summarize renal-liver function. Our aim has been to test the MELD score as a prognostic tool in amyloidosis. We evaluated 128 patients, 46 with TTR-related amyloidosis and 82 with AL amyloidosis. All patients had a complete clinical and echocardiography evaluation; overall biohumoral assessment included troponin I, NT-proBNP, creatinine, total bilirubin and INR ratio. The study population was dichotomized at the 12 cut-off level of MELD scores; those with MELD score >12 had a lower survival compared to controls in the study cohort (40.7 vs 66.3 %; p = 0.006). Either as a continuous and dichotomized variable, MELD shows its independent prognostic value at multivariable analysis (HR = 1.199, 95 % CI 1.082-1.329; HR = 2.707, 95 % CI 1.075-6.817, respectively). MELD shows a lower prognostic sensitivity/specificity ratio than troponin I and NT-proBNP in the whole study population and AL subgroup, while in TTR patients MELD has a higher sensitivity/specificity ratio compared to troponin and NT-proBNP (ROC analysis-AUC: 0.853 vs 0.726 vs 0.659). MELD is able to predict prognosis in amyloidosis. A MELD score >12 selects a subgroup of patients with a higher risk of death. The predictive accuracy seems to be more evident in TTR patients in whom currently no effective scoring systems have been validated.","Cappelli F, Baldasseroni S, Bergesio F, Spini V, Fabbri A, Angelotti P, Grifoni E, Attanà P, Tarantini F, Marchionni N, Moggi Pignone A, Perfetto F",Intern Emerg Med. 2017 Feb;12(1):23-30. doi: 10.1007/s11739-016-1500-0. Epub 2016 Aug 1.,10.1007/s11739-016-1500-0 [pii]
