Title,Abstract,Authors,Journal,DOI
Impact of disease-modifying therapies on imaging parameters in cardiac amyloidosis: A systematic review and meta-analysis.,"Transthyretin-mediated (ATTR) and immunoglobulin light-chain (AL) cardiac amyloidosis causes progressive myocardial dysfunction and poor prognosis. Disease-specific therapies in ATTR and anti-clonal therapies in AL cardiac amyloidosis may modify disease, but treatment-induced changes in prognostic cardiac imaging markers remain incompletely defined. We systematically searched PubMed/MEDLINE, Scopus, CINAHL, Web of Science, and EMBASE for studies reporting treatment-associated changes in global longitudinal strain (GLS), left ventricular (LV) wall thickness, and extracellular volume (ECV) assessed by echocardiography or cardiac magnetic resonance. Random-effects meta-analyses pooled mean changes. Seventeen studies met inclusion criteria. In ATTR cardiac amyloidosis, therapy with silencers or RNA-depleting agents was associated with improved GLS (pooled mean difference [MD] -0.97 %, 95 % CI -1.27 to -0.68) and reduced LV wall thickness (MD -0.72 mm, 95 % CI -1.26 to -0.17) versus no therapy, while ECV showed no significant change (MD -1.93 %, 95 % CI -15.27 to 11.41). In AL amyloidosis, complete hematologic response was linked to greater improvement than non-response in GLS (MD -1.19 %, 95 % CI -2.20 to -0.17) and LV wall thickness (MD -0.87 mm, 95 % CI -1.31 to -0.43). NMA in ATTR cardiac amyloidosis showed that patisiran (MD -1.04 %, 95 % CI -1.56 to -0.52), tafamidis (-0.91 %, -1.40 to -0.41), and vutrisiran (-0.90 %, -1.75 to -0.05) improved GLS versus placebo, compared to acoramidis. Disease-directed therapy in ATTR and hematologic response in AL cardiac amyloidosis are associated with preservation or improvement of GLS and LV wall thickness, supporting their use as surrogate endpoints for treatment monitoring.","Briasoulis A, Georgiopoulos G, Kourek C, Patras R, Lama N, Theodorakakou F, Tepetes N, Zervas G, Androulakis E, Kastritis E, Stamatelopoulos K",Curr Probl Cardiol. 2026 Apr;51(4):103265. doi: 10.1016/j.cpcardiol.2026.103265. Epub 2026 Jan 17.,S0146-2806(26)00008-3 [pii]
A Pilot Study of Rare Renal Amyloidosis Based on FFPE Proteomics.,"Renal amyloidosis typically manifests albuminuria, nephrotic-range proteinuria, and ultimately progresses to end-stage renal failure if diagnosed late. Different types of renal amyloidosis have completely different treatments and outcomes. Therefore, amyloidosis typing is essential for disease prognosis, genetic counseling and treatment. Thirty-six distinct proteins currently known to cause amyloidosis that have been described as amyloidogenic precursors, immunohistochemistry (IHC) or immunofluorescence (IF), can be challenging for amyloidosis typing especially in rare or hereditary amyloidosis in clinical practice. We made a pilot study that optimized the proteomics pre-processing procedures for trace renal amyloidosis formalin-fixed paraffin-embedded (FFPE) tissue samples, combined with statistical and bioinformatics analysis to screen out the amyloidosis-related proteins to accurately type or subtype renal amyloidosis in order to achieve individual treatment. A sensitive, specific and reliable FFPE-based proteomics analysis for trace sample manipulation was developed for amyloidosis typing. Our results not only underlined the great promise of traditional proteomics and bioinformatics analysis using FFPE tissues for amyloidosis typing, but also proved that retrospective diagnosis and analysis of previous cases laid a solid foundation for personalized treatment.","Meng S, Xia W, Xia L, Zhou L, Xu J, Pan X, Meng L",Molecules. 2021 Nov 29;26(23):7234. doi: 10.3390/molecules26237234.,molecules26237234 [pii]
Prevalence of Right Atrial Impairment and Association with Outcomes in Cardiac Amyloidosis.,"BACKGROUND: Cardiac amyloidosis (CA) is an infiltrative cardiomyopathy in which abnormally folded proteins deposit within the myocardium and the atrial walls. While left atrial dysfunction has been previously reported, the impact of CA on right atrial (RA) structure and function is unknown. METHODS: We retrospectively studied 118 patients (67 immunoglobulin light chain [AL-CA], 51 transthyretin [ATTR-CA]; age, 70 ± 12 years; 57% men) who underwent transthoracic echocardiogram in sinus rhythm. Right atrial reservoir, conduit, and booster strain were quantified using speckle-tracking and compared between patients with CA and 50 healthy age-, sex-, and race-matched controls using the chi-squared or Mann-Whitney test. The relationship between RA parameters and mortality was assessed using Cox regression. RESULTS: Right atrial volume was significantly larger in cases with CA compared with in controls: 29 (22-37) vs 21 (15-25) mL/m(2), P < .001. Right atrial reservoir (21% [14%-35%] vs 37% [34%-43%], P < .001), conduit 11% [18%-6%] vs 14% [11%-17%], P < .001), and booster (10% [17%-5%] vs 23% [20%-27%], P < .001) strains were all significantly more impaired in the CA group compared with controls. Compared with AL-CA, ATTR-CA patients had significantly larger RA volume (34 [26-44] vs 28 [20-35] mL/m(2), P = .005) and significantly more impaired RA reservoir (17% [10%-30%] vs 27% [17%-37%], P = .007), conduit (8% [13%-6%] vs 13% [20%-8%], P = .031), and booster (7% [14%-4%] vs 11% [18%-6%], P = .030) strain. Among CA patients, RA reservoir (hazard ratio = 0.97 per %, P = .006) and RA conduit (hazard ratio = 1.05 per %, P = .004) were significantly associated with mortality, while RA volume (P = .362) and RA booster strain (P = .180) were not. CONCLUSIONS: In CA, abnormalities in RA size and strain are highly prevalent and associated with worse prognosis, suggesting the presence of intrinsic RA atriopathy. Right atrial strain appears to be a potentially useful marker in the diagnosis, subtype differentiation, and risk stratification of CA.","Singulane CC, Slivnick JA, Addetia K, Asch FM, Sarswat N, Soulat-Dufour L, Mor-Avi V, Lang RM",J Am Soc Echocardiogr. 2022 Aug;35(8):829-835.e1. doi: 10.1016/j.echo.2022.03.022. Epub 2022 Apr 7.,S0894-7317(22)00175-4 [pii]
The short and long-term characteristics and outcomes of patients with grade 1 myocardial uptake on cardiac scintigraphy.,"AIMS: This study aimed to characterize the final diagnosis and prognosis of patients with grade 1 myocardial scintigraphy uptake, which is an unequivocal result for the diagnosis of transthyretin cardiac amyloidosis (ATTR-CA) requiring further invasive investigation with tissue biopsy. METHODS AND RESULTS: We retrospectively compared the clinical and imaging parameters of patients suspected for ATTR-CA (based on clinical and echocardiographic parameters) with grade 1 vs. grades 2/3 technetium pyrophosphate uptake on cardiac scintigraphy. Prospectively, grade 1 patients underwent re-evaluation for ATTR-CA at long term. Of the 132 ATTR-CA suspected patients, 89 (67%) were diagnosed as grade 1 and 43 (33%) as grades 2/3 uptake. Grade 1 vs. grades 2/3 patients were younger and female predominant with lower biomarker levels and left ventricular mass. Based on available imaging and pathology findings, only 6 out of the 89 patients with grade 1 uptake (7%) were finally diagnosed with light-chain cardiac amyloidosis, whereas no patient was diagnosed with ATTR-CA. At 2 [interquartile range (IQR) 0.75, 3.25] years of follow-up, the survival of patients with grade 1 vs. grades 2/3 uptake was significantly better [hazard ratio 0.271 (95% confidence interval 0.130 to 0.563, P = 0.0005)]. Prospectively, 30 patients with grade 1 uptake were re-evaluated at a median follow-up of 3.2 (IQR 2.2, 3.9) years. Their New York Heart Association class, biomarker levels, and echocardiography findings remained stable. No patient (0/25) demonstrated grades 2/3 uptake at repeated long-term scintigraphy. CONCLUSIONS: Patients with suspected ATTR-CA and a grade 1 scintigraphy uptake demonstrate a stable clinical, laboratory, imaging, and scintigraphy phenotype along with a benign survival profile at long-term follow-up. Larger studies should define the optimal evaluation strategy in this population.","Itzhaki Ben Zadok O, Ruhrman-Sahar N, Mats I, Vaxman I, Shiyovich A, Aviv Y, Vaturi M, Wiessman M, Shochat T, Kandinov I, Kornowski R, Hamdan A",ESC Heart Fail. 2023 Jun;10(3):1666-1676. doi: 10.1002/ehf2.14312. Epub 2023 Feb 17.,EHF214312 [pii]
Fibril-directed Therapies in Systemic Light Chain AL Amyloidosis.,"Immunoglobulin light chain amyloidosis (AL amyloidosis) is a plasma cell disorder leading to the production and extracellular deposition of abnormal immunoglobulin light chains called amyloid. The pathogenesis of the disorder is driven by an abnormal plasma cell clone producing excessive monoclonal immunoglobulin light chains, which undergo deposition in various organs of the body such as the heart, kidney, and gastrointestinal tract. The outcome of the disease remains poor, with significant morbidity and mortality associated with the organ dysfunction. The mainstay of therapy remains targeting the plasma cell clone to decrease or eliminate the production of the abnormal light chains. These therapies include agents such as proteasome inhibitors, immunomodulators, and use of autologous stem cell transplantation. Although current therapies offer potential for disease control and improvement in survival, they cannot reverse light chain deposits in the organs. Newer therapies targeting the light chain fibrils in the form of antibodies binding to the amyloid protein in the organ have recently been developed and have shown early efficacy in clinical trials. In this review, we outline the preclinical work, mechanisms of action, and the clinical efficacy of fibril-directed therapies for light chain amyloidosis.","Bhutani D, Leng S, Lentzsch S",Clin Lymphoma Myeloma Leuk. 2019 Sep;19(9):555-559. doi: 10.1016/j.clml.2019.03.029. Epub 2019 Apr 1.,S2152-2650(18)31673-2 [pii]
Differential expression of MAP3K7 and TROPONIN C proteins and related perturbations in renal amyloidosis.,"OBJECTIVES: Renal amyloidosis (RA) is a rare protein misfolding disorder that prompts progressive renal insufficiency. This study aimed to decipher proteomic changes in human sera to understand the pathophysiology and molecular mechanisms underlying the disease development, hence assisting in the diagnosis of RA. METHODS: Serum proteomic analysis was performed using a gel-based approach followed by MALDI-TOF MS. RA patients with age and sex matched healthy volunteers were recruited from Max Super Speciality Hospital, New Delhi, India. RESULTS: Proteome profiles of serum revealed eight differentially expressed proteins namely, Zinc finger protein 624, Protein FAM183A, Calcium-binding mitochondrial carrier protein Scamc-3, V-type proton ATPase 116 kDa subunit A isoforms 2, Protein TXNRD3NB, ATP - dependent RNA helicase, Troponin C and Mitogen-activated protein kinase kinase kinase 7. These proteins were reported first time in RA. The increased levels of MAP3K7 and TROPONIN C were validated by bio-layer interferometry and their diagnostic accuracy was evaluated by ROC curve analysis. The differentially expressed proteins were predominantly associated with vesicular trafficking, transcriptional regulation, metabolic processes, apoptotic process and mitochondrial metabolism. CONCLUSION: The results indicate that these proteomic signatures may be considered as potential molecular targets for RA diagnostics and therapeutics subject to validation on large sample size. Abbreviations: AβP= Amyloid-beta protein, Aβ=Amyloid-beta, AL= Light chain amyloidosis, AA= Amyloid A, ALECT2= LECT2 amyloidosis, APS= Ammonium persulfate CKD= Chronic Kidney Diseases, EBRT= external beam radiation therapy, ESRD= End-Stage Kidney Disease, Glis2= Gli-similar 2, JNK= c-Jun NH 2-terminal kinase, MAPK= Mitogen-Activated Protein Kinase, MM=Multiple Myeloma, PHD= Prolyl hydroxylase, RA = Renal Amyloidosis, SAA= Serum Amyloid A, SD= Standard Deviation, Sepp= Selenoprotein, SCC= Squamous cell carcinoma, SDS= Sodium dodecyl sulfate, TEMED = tetramethyl ethylenediamine, TGF-Beta-1=Transforming growth factor- Beta-1, Trx = Thioredoxin, TrxR= Thioredoxin reductase.","Gupta N, Sahar T, Khullar D, Jain SK, Wajid S",Expert Rev Proteomics. 2020 Sep;17(9):685-694. doi: 10.1080/14789450.2020.1833722. Epub 2020 Nov 1.,10.1080/14789450.2020.1833722 [doi]
Predictors of mortality by an artificial intelligence enhanced electrocardiogram model for cardiac amyloidosis.,"AIMS: We aim to determine if our previously validated, diagnostic artificial intelligence (AI) electrocardiogram (ECG) model is prognostic for survival among patients with cardiac amyloidosis (CA). METHODS: A total of 2533 patients with CA (1834 with light chain amyloidosis (AL), 530 with wild-type transthyretin amyloid protein (ATTRwt) and 169 with hereditary transthyretin amyloid (ATTRv)] were included. An amyloid AI ECG (A2E) score was calculated for each patient reflecting the likelihood of CA. CA stage was calculated using the European modification of the Mayo 2004 criteria for AL and Mayo stage for transthyretin amyloid (ATTR). Risk of death was modelled using Cox proportional hazards, and Kaplan-Meier was used to estimate survival. RESULTS: Median age of the cohort was 67 [inter-quartile ratio (IQR) 59, 74], and 71.6% were male. The median overall survival for the cohort was 35.6 months [95% confidence interval (CI) 32.3, 39.5]. For AL, ATTRwt and ATTRv, respectively, median survival was 22.9 (95% CI 19.2, 28.2), 47.2 (95% CI 43.4, 52.3) and 61.4 (95% CI 48.7, 75.9) months. On univariate analysis, an increasing A2E score was associated with more than a two-fold risk of all-cause death. On multivariable analysis, the A2E score retained its importance with a risk ratio of 2.0 (95% CI 1.58, 2.55) in the AL group and 2.7 (95% CI 1.81, 4.24) in the ATTR group. CONCLUSIONS: Among patients with AL and ATTR amyloidosis, the A2E model helps to stratify risk of CA and adds another dimension of prognostication.","Amadio JM, Grogan M, Muchtar E, Lopez-Jimenez F, Attia ZI, AbouEzzeddine O, Lin G, Dasari S, Kapa S, Borgeson DD, Friedman PA, Gertz MA, Murphree DH Jr, Dispenzieri A",ESC Heart Fail. 2025 Feb;12(1):677-682. doi: 10.1002/ehf2.15061. Epub 2024 Aug 31.,EHF215061 [pii]
"Cardiac amyloidosis: An update on pathophysiology, diagnosis, and treatment.","The amyloidoses are a group of systemic diseases characterized by organ deposition of misfolded protein fragments of diverse origins. The natural history of the disease, involvement of other organs, and treatment options vary significantly based on the protein of origin. In AL amyloidosis, amyloid protein is derived from immunoglobulin light chains, and most often involves the kidneys and the heart. ATTR amyloidosis is categorized as mutant or wild-type depending on the genetic sequence of the transthyretin (TTR) protein produced by the liver. Wild-type ATTR amyloidosis mainly involves the heart, although the reported occurrence of bilateral carpal tunnel syndrome, spinal stenosis and biceps tendon rupture in these patients speaks to more generalized protein deposition. Mutant TTR is marked by cardiac and/or peripheral nervous system involvement. Cardiac involvement is associated with symptoms of heart failure, and dictates the clinical course of the disease. Cardiac amyloidosis can be diagnosed noninvasively by echocardiography, cardiac MRI, or nuclear scintigraphy. Endomyocardial biopsy may be needed in the case of equivocal imaging findings or discordant data. Treatment is aimed at relieving congestive symptoms and targeting the underlying amyloidogenic process. This includes anti-plasma cell therapy in AL amyloidosis, and stabilization of the TTR tetramer or inhibition of TTR protein production in ATTR amyloidosis. Cardiac transplantation can be considered in highly selected patients in tandem with therapy aimed at suppressing the amyloidogenic process, and appears associated with durable long-term survival.","Siddiqi OK, Ruberg FL",Trends Cardiovasc Med. 2018 Jan;28(1):10-21. doi: 10.1016/j.tcm.2017.07.004. Epub 2017 Jul 13.,S1050-1738(17)30108-1 [pii]
A new era of amyloidosis: the trends at a major US referral centre.,"Objective: To characterize the changing spectrum of amyloidosis classes, as well as patient demographics, at a major US referral centre. Patients and methods: A retrospective analysis was conducted of all referrals to the Amyloidosis Centre at Boston University and Boston Medical Centre over the last 3 decades. Results: A total of 3987 new patients with amyloidosis were evaluated between 1990 and 2018 with the average number of new cases per year increasing 2.5-fold during this period. Systemic immunoglobulin light-chain (AL) amyloidosis decreased in proportion with each decade from 77% to 69% to 50% of new cases. Meanwhile, ATTR amyloidosis increased from 12% to 16% to 29%, predominately due to more diagnosis of ATTRwt and ATTRV122I amyloidosis. Gender and race profile differences, while changing over the observed time period, persisted among amyloidosis patients. Conclusion: Amyloid diseases are more widely recognized and classes of amyloidosis, including ATTRwt and ATTRV122I, once considered rare are now increasingly diagnosed. These data likely reflect a national trend of increased amyloidosis awareness facilitated by accessible diagnostic approaches, emerging treatments, and coordinated educational initiatives. ClinicalTrials.gov identifier: NCT00898235.","Staron A, Connors LH, Ruberg FL, Mendelson LM, Sanchorawala V",Amyloid. 2019 Dec;26(4):192-196. doi: 10.1080/13506129.2019.1640672. Epub 2019 Jul 15.,10.1080/13506129.2019.1640672 [doi]
Deferred autologous stem cell transplantation in systemic AL amyloidosis.,"High-dose melphalan with autologous stem cell transplantation (ASCT) can induce durable haematological and organ responses in systemic AL amyloidosis (AL). Stringent selection criteria have improved safety of ASCT in AL but most patients are transplant-ineligible. We report our experience of deferred ASCT in AL patients who were transplant-ineligible at presentation but had improvements in organ function after induction chemotherapy, enabling them to undergo ASCT. Twenty-two AL patients underwent deferred ASCT from 2011 to 2017. All had serial organ function and clonal response assessment. Organ involvement and responses were defined by amyloidosis consensus criteria. All patients were transplant-ineligible at presentation, predominantly due to advanced cardiac involvement. All received bortezomib-based therapy, with 100% haematologic response (86% complete response (CR)/very good partial response (VGPR)), enabling reversal of ASCT exclusion criteria. Patients underwent deferred ASCT for haematologic progression (45%) or consolidation (55%). There was no transplant-related mortality. Haematologic responses post-ASCT: CR 50%, VGPR 27%, PR 18%, non-response 5%. In all, 85.7% achieved cardiac responses. Median overall survival (OS) was not reached. Median progression-free survival (PFS) was 54 months. This selected cohort achieved excellent haematologic responses, organ responses, PFS and OS with deferred ASCT. If larger studies confirm these findings, this may widen the applicability of ASCT in AL.","Manwani R, Hegenbart U, Mahmood S, Sachchithanantham S, Kyriakou C, Yong K, Popat R, Rabin N, Whelan C, Dittrich T, Kimmich C, Hawkins P, Schönland S, Wechalekar A",Blood Cancer J. 2018 Nov 5;8(11):101. doi: 10.1038/s41408-018-0137-9.,10.1038/s41408-018-0137-9 [pii]
Changes in the diagnostic trajectory of transthyretin cardiac amyloidosis over six years.,"Awareness of transthyretin amyloid cardiomyopathy (ATTR-CM) has increased over the years due to diagnostic and therapeutic developments. Timely initiation of novel disease-modifying treatments improves both morbidity and mortality, which underlines the necessity for a prompt diagnosis. Nevertheless, early diagnosis of ATTR-CM remains challenging. This is a retrospective observational cohort study of patients diagnosed with ATTR-CM. Between 2016 and 2023, 87 patients were diagnosed with cardiac amyloidosis of which 65 (75%) patients with ATTR-CM and 22 (25%) patients with light chain amyloidosis. This study included 65 ATTR-CM patients (mean age 77 ± 7 years; 86% male) of whom 59 (91%) with wild-type ATTR-CM (ATTRwt) and six (9%) with variant ATTR-CM. We observed a surge in ATTR-CM diagnoses from 3 patients/year (2016-2020) to 16 patients/year (2021-2023), driven by ATTRwt. Nevertheless, the interval between the onset of heart failure symptoms and ATTR-CM diagnosis has not changed significantly (2016-2020 27.3 months [18.6-62.4]; 2021-2023 30.0 months [8.6-57.2]; p = 0.546), driven by time to referral. Red flags for ATTR-CM preceded diagnosis by several years: left ventricular hypertrophy (79%, 5.8 years [3.3-7.0]) and carpal tunnel syndrome (49%, 6.8 years [2.3-12.1]). Despite the presence of typical red flags, symptom-to-diagnosis duration has remained similar driven by time to referral. Improved recognition of red flags for ATTR-CM could reduce the time to diagnosis and improve overall recognition.","Achten A, van Empel VPM, Weerts J, Mourmans S, Beckers-Wesche F, Spanjers M, Gingele A, Brunner-La Rocca HP, Sanders-van Wijk S, Knackstedt C",Heart Vessels. 2024 Oct;39(10):857-866. doi: 10.1007/s00380-024-02408-3. Epub 2024 May 6.,10.1007/s00380-024-02408-3 [pii]
Left atrial function in patients with light chain amyloidosis: A transthoracic 3D speckle tracking imaging study.,"BACKGROUND: Systemic light chain amyloidosis (AL) is characterized by the extracellular deposition of amyloid fibrils. Transthoracic echocardiography is the modality of choice to assess cardiac function in patients with AL. Whereas left ventricular (LV) function has been well studied in this patient population, data regarding the value of left atrial (LA) function in AL patients are lacking. In this study, we aim to examine the impact of LA volumes and function on survival in AL patients as assessed by real-time 3D echocardiography. METHODS: A total of 77 patients (67±10 years, 60% men) with confirmed AL and 39 healthy controls were included. All standard 2D echocardiographic and 3D-LA parameters were obtained. RESULTS: Fourteen patients (18%) were in Mayo Clinic (MC) stage I, 30 (39%) in stage II, and 33 (43%) in stage III at initial evaluation. There was no significant difference among the MC stages groups in terms of age, gender, or cardiovascular risk factors. As compared to patients in MC II and MC I, those in MC III had significantly larger indexed 3D-LA volumes (MCIII: 46±15mL/m(2), MC II: 38±12mL/m(2), and MC I: 23±9mL/m(2), p<0.0001), lower 3D-LA total emptying fraction (3D-tLAEF) (21±13% vs. 31±15% vs. 43±7%, respectively, p<0.0001), and worse 3D peak atrial longitudinal strain (3D-PALS) (11±9% vs. 18±13% vs. 20±7%, respectively, p=0.007). Two-year survival was significantly lower in patients with 3D-tLAEF <+34% (p=0.003) and in those with 3D-PALS <+14% (p=0.034). Both parameters provided incremental prognostic value over maximal LA volume in multivariate analysis. CONCLUSION: Functional LA parameters are progressively altered in AL patients according to the MC stage. A decrease in 3D-PALS is associated with worse outcome, independently of LA volume.","Mohty D, Petitalot V, Magne J, Fadel BM, Boulogne C, Rouabhia D, El Hamel C, Lavergne D, Damy T, Aboyans V, Jaccard A",J Cardiol. 2018 Apr;71(4):419-427. doi: 10.1016/j.jjcc.2017.10.007. Epub 2017 Nov 16.,S0914-5087(17)30276-9 [pii]
Wild-type transthyretin cardiac amyloidosis: a case of multisystemic involvement and review of literature.,"INTRODUCTION: Cardiac amyloidosis (CA) represents a progressively evolving infiltrative pathology, defined by the myocardial accumulation of amyloid fibrils. The condition predominantly originates from transthyretin-derived (ATTR) or immunoglobulin light chain-related (AL) amyloidosis. ATTR cardiomyopathy (ATTR-CM), particularly the wild-type (wt) form (wtATTR-CM), is becoming more widely acknowledged as a contributor to cardiac dysfunction in the elderly population. However, diagnosing ATTR-CM remains challenging due to its clinical similarity to other cardiac conditions and a history of frequent misdiagnoses. Recent advancements in nuclear imaging using bone-avid radiotracers have greatly improved the ability to diagnose ATTR-CM non-invasively. CASE PRESENTATION: This case involves an 86-year-old male with documented peripheral joint disease, supraspinatus tendon rupture affecting both limbs, referred for exertional dyspnea. Echocardiography indicated left ventricular hypertrophy, diastolic dysfunction, reduced global longitudinal strain, accompanied by severe mitral regurgitation (MR) secondary to prolapse of the posterior mitral leaflet. Cardiac magnetic resonance (CMR) imaging revealed concentric hypertrophy, elevated T1 mapping, and increased extracellular volume, highly suggestive of amyloid deposition. Bone scintigraphy confirmed the diagnosis of ATTR-CM with a Perugini score of 3. A biopsy of the abdominal fat pad revealed amyloid deposits. CONCLUSIONS: Such presentations of ATTR-CM emphasize its systemic nature and the need for early recognition and treatment. An important aspect of this case is the uncommon association between CA and posterior mitral valve prolapse, which leads to significant MR.","Moise CG, Negroiu CE, Mirea O, Tudoraşcu RI, Vînturiş EG, Dănoiu S, Donoiu I, Ştefan A, Raicea VC",Rom J Morphol Embryol. 2025 Apr-Jun;66(2):279-289. doi: 10.47162/RJME.66.2.02.,660225279289 [pii]
