Title,Abstract,Authors,Journal,DOI
Cardiac amyloidosis.,"Cardiac amyloidosis is a disease characterised by the accumulation of amyloid protein in the heart tissue. There are several types of amyloidosis, but the most common types affecting the heart are ATTR amyloidosis (caused by transthyretin protein) and AL amyloidosis (caused by abnormal immunoglobulin light chains). Cardiac amyloidosis causes typical signs and symptoms of heart failure. Diagnosis involves a combination of imaging tests such as echocardiography and cardiac magnetic resonance imaging, as well as nuclear imaging scans and tissue biopsies to confirm the presence of amyloid deposits in the heart. Treatment of cardiac amyloidosis depends on the type and severity of the disease and includes medications to manage symptoms as well as treatments targeting the underlying cause of amyloidosis. Importantly, cardiac amyloidosis is a serious condition requiring specialised care from a multidisciplinary team including cardiologists and haematologists as well as other specialists familiar with the management of this rare disease. This is crucial, as early diagnosis and treatment are important for improving outcomes.","Laptseva N, Benz DC, Schwotzer R, Flammer AJ",Swiss Med Wkly. 2024 Nov 14;154:4186. doi: 10.57187/s.4186.,4186 [pii]
Cardiac amyloidosis.,"Systemic amyloidosis comprises an uncommon group of disorders caused by the extracellular deposition of misfolded proteins in various organs. Cardiac amyloid deposition, causing an infiltrative/restrictive cardiomyopathy, is a frequent feature of amyloidosis and a major determinant of survival. It may be the presenting feature of the disease or may be identified while investigating a patient presenting with other organ involvement. The need for a high index of suspicion and the critical importance of precise biochemical typing of the amyloid deposits is paramount in light of recent therapeutic advances that can significantly improve prognosis. Most cases of cardiac amyloidosis are of either transthyretin type, which may be acquired in older individuals or inherited in younger patients, or acquired monoclonal immunoglobulin light chain (AL) type. This article aims to review recent developments in diagnosis and management of cardiac amyloidosis.","Martinez-Naharro A, Hawkins PN, Fontana M",Clin Med (Lond). 2018 Apr 1;18(Suppl 2):s30-s35. doi: 10.7861/clinmedicine.18-2-s30.,S1470-2118(24)00083-6 [pii]
Biomarkers in AL Amyloidosis.,"Systemic AL amyloidosis is a rare complex hematological disorder caused by clonal plasma cells which produce amyloidogenic immunoglobulins. Outcome and prognosis is the combinatory result of the extent and pattern of organ involvement secondary to amyloid fibril deposition and the biology and burden of the underlying plasma cell clone. Prognosis, as assessed by overall survival, and early outcomes is determined by degree of cardiac dysfunction and current staging systems are based on biomarkers that reflect the degree of cardiac damage. The risk of progression to end-stage renal disease requiring dialysis is assessed by renal staging systems. Longer-term survival and response to treatment is affected by markers of the underlying plasma cell clone; the genetic background of the clonal disease as evaluated by interphase fluorescence in situ hybridization in particular has predictive value and may guide treatment selection. Free light chain assessment forms the basis of hematological response criteria and minimal residual disease as assessed by sensitive methods is gradually being incorporated into clinical practice. However, sensitive biomarkers that could aid in the early diagnosis and that could reflect all aspects of organ damage and disease biology are needed and efforts to identify them are continuous.","Fotiou D, Theodorakakou F, Kastritis E",Int J Mol Sci. 2021 Oct 9;22(20):10916. doi: 10.3390/ijms222010916.,ijms222010916 [pii]
"The Last Decade in Cardiac Amyloidosis: Advances in Understanding Pathophysiology, Diagnosis and Quantification, Prognosis, Treatment Strategies, and Monitoring Response.","Cardiac amyloidosis represents a unique disease process characterized by amyloid fibril deposition within the myocardial extracellular space. Advances in multimodality cardiac imaging enable accurate diagnosis and facilitate prompt initiation of disease-modifying therapies. Furthermore, rapid advances in multimodality imaging have enriched understanding of the underlying pathogenesis, enhanced prognostication, and resulted in the development of imaging-based markers that reflect the amyloid burden, which is of increasing importance when assessing the response to treatment. Whereas conventional therapies have focused on reducing amyloid formation and subsequent stabilization of the cardiac disease process, novel agents are being developed to accelerate the immune-mediated removal of amyloid fibrils from the heart. In this context, the ability to track changes in the amyloid burden over time is of paramount importance. Although advanced imaging techniques have shown efficacy in tracking the treatment response, future research focused on improved precision through use of artificial intelligence may augment the detection of changes earlier in the course of treatment.","Fontana M, Ioannou A, Cuddy S, Dorbala S, Masri A, Moon JC, Singh V, Clerc O, Hanna M, Ruberg F, Grogan M, Emdin M, Gillmore J",JACC Cardiovasc Imaging. 2025 Apr;18(4):478-499. doi: 10.1016/j.jcmg.2024.10.011. Epub 2025 Jan 8.,S1936-878X(24)00458-3 [pii]
Transthyretin cardiac amyloidosis.,"Transthyretin cardiac amyloidosis (ATTR-CA) is an increasingly recognized cause of heart failure (HF) and mortality worldwide. Advances in non-invasive diagnosis, coupled with the development of effective treatments, have shifted ATTR-CA from a rare and untreatable disease to a relatively prevalent condition that clinicians should consider on a daily basis. Amyloid fibril formation results from age-related failure of homoeostatic mechanisms in wild-type ATTR (ATTRwt) amyloidosis (non-hereditary form) or destabilizing mutations in variant ATTR (ATTRv) amyloidosis (hereditary form). Longitudinal large-scale studies in the United States suggest an incidence of cardiac amyloidosis in the contemporary era of 17 per 100 000, which has increased from a previous estimate of 0.5 per 100 000, which was almost certainly due to misdiagnosis and underestimated. The presence and degree of cardiac involvement is the leading cause of mortality both in ATTRwt and ATTRv amyloidosis, and can be identified in up to 15% of patients hospitalized for HF with preserved ejection fraction. Associated features, such as carpal tunnel syndrome, can preceed by several years the development of symptomatic HF and may serve as early disease markers. Echocardiography and cardiac magnetic resonance raise suspicion of disease and might offer markers of treatment response at a myocardial level, such as extracellular volume quantification. Radionuclide scintigraphy with 'bone' tracers coupled with biochemical tests may differentiate ATTR from light chain amyloidosis. Therapies able to slow or halt ATTR-CA progression and increase survival are now available. In this evolving scenario, early disease recognition is paramount to derive the greatest benefit from treatment.","Porcari A, Fontana M, Gillmore JD",Cardiovasc Res. 2023 Feb 3;118(18):3517-3535. doi: 10.1093/cvr/cvac119.,6656156 [pii]
How to Image Cardiac Amyloidosis: A Practical Approach.,"Cardiac amyloidosis (CA) is one of the most rapidly progressive forms of heart disease, with a median survival from diagnosis, if untreated, ranging from <6 months for light chain amyloidosis to 3 to 5 years for transthyretin amyloidosis. Early diagnosis and accurate typing of CA are necessary for optimal management of these patients. Emerging novel disease modifying therapies increase the urgency to diagnose CA at an early stage and identify patients who may benefit from these life-saving therapies. The goal of this review is to provide a practical approach to echocardiography, cardiac magnetic resonance, and radionuclide imaging in patients with known or suspected CA.","Dorbala S, Cuddy S, Falk RH",JACC Cardiovasc Imaging. 2020 Jun;13(6):1368-1383. doi: 10.1016/j.jcmg.2019.07.015. Epub 2019 Oct 11.,S1936-878X(19)30713-2 [pii]
Understanding and recognizing cardiac amyloidosis.,"Cardiac amyloidosis is an infiltrative abnormality that causes myocardial thickening and dysfunction. Historically, it has been underrecognized as a cause of heart failure and was often misdiagnosed. In the past decade, the cardiology community has improved the understanding of the subtypes of these protein-based infiltrates and how they play a role in heart failure. This article reviews the pathophysiology, presentation, diagnosis, and management of cardiac amyloidosis.","McVeigh T, Tennyson C",JAAPA. 2020 Oct;33(10):16-20. doi: 10.1097/01.JAA.0000697236.11386.3a.,01720610-202010000-00001 [pii]
Imaging-Guided Treatment for Cardiac Amyloidosis.,"PURPOSE OF REVIEW: This review will explore the role of cardiac imaging in guiding treatment in the two most commonly encountered subtypes of cardiac amyloidosis (immunoglobulin light-chain amyloidosis [AL] and transthyretin amyloidosis [ATTR]). RECENT FINDINGS: Advances in multi-parametric cardiac imaging involving a combination of bone scintigraphy, echocardiography and cardiac magnetic resonance imaging have resulted in earlier diagnosis and initiation of treatment, while the evolution of techniques such as longitudinal strain and extracellular volume quantification allow clinicians to track individuals' response to treatment. Imaging developments have led to a deeper understanding of the disease process and treatment mechanisms, which in combination result in improved patient outcomes. The rapidly expanding treatment regimens for cardiac amyloidosis have led to an even greater reliance on cardiac imaging to help establish an accurate diagnosis, monitor treatment response and aid the adjustment of treatment strategies accordingly.","Ioannou A, Patel R, Gillmore JD, Fontana M",Curr Cardiol Rep. 2022 Jul;24(7):839-850. doi: 10.1007/s11886-022-01703-7. Epub 2022 May 7.,10.1007/s11886-022-01703-7 [pii]
Multiparametric Echocardiography Scores for the Diagnosis of Cardiac Amyloidosis.,"OBJECTIVES: This study aimed to investigate the accuracy of a broad range of echocardiographic variables to develop multiparametric scores to diagnose CA in patients with proven light chain (AL) amyloidosis or those with increased heart wall thickness who had amyloid was suspected. We also aimed to further characterize the structural and functional changes associated with amyloid infiltration. BACKGROUND: Cardiac amyloidosis (CA) is a serious but increasingly treatable cause of heart failure. Diagnosis is challenging and frequently unclear at echocardiography, which remains the most often used imaging tool. METHODS: We studied 1,187 consecutive patients evaluated at 3 referral centers for CA and analyzed morphological, functional, and strain-derived echocardiogram parameters with the aim of developing a score-based diagnostic algorithm. Cardiac amyloid burden was quantified by using extracellular volume measurements at cardiac magnetic resonance. RESULTS: A total of 332 patients were diagnosed with AL amyloidosis and 339 patients with transthyretin CA. Concentric remodeling and strain-derived parameters displayed the best diagnostic performance. A multivariable logistic regression model incorporating relative wall thickness, E wave/e' wave ratio, longitudinal strain, and tricuspid annular plane systolic excursion had the greatest diagnostic performance in AL amyloidosis (area under the curve: 0.90; 95% confidence interval: 0.87 to 0.92), whereas the addition of septal apical-to-base ratio yielded the best diagnostic accuracy in the increased heart wall thickness group (area under the curve: 0.80; 95% confidence interval: 0.85 to 0.90). CONCLUSIONS: Specific functional and structural parameters characterize different burdens of CA deposition with different diagnostic performances and enable the definition of 2 scores that are sensitive and specific tools with which diagnose or exclude CA.","Boldrini M, Cappelli F, Chacko L, Restrepo-Cordoba MA, Lopez-Sainz A, Giannoni A, Aimo A, Baggiano A, Martinez-Naharro A, Whelan C, Quarta C, Passino C, Castiglione V, Chubuchnyi V, Spini V, Taddei C, Vergaro G, Petrie A, Ruiz-Guerrero L, Moñivas V, Mingo-Santos S, Mirelis JG, Dominguez F, Gonzalez-Lopez E, Perlini S, Pontone G, Gillmore J, Hawkins PN, Garcia-Pavia P, Emdin M, Fontana M",JACC Cardiovasc Imaging. 2020 Apr;13(4):909-920. doi: 10.1016/j.jcmg.2019.10.011. Epub 2019 Dec 18.,S1936-878X(19)31007-1 [pii]
Amyloid cardiomyopathy.,"Cardiac amyloidosis is a heterogeneous group of diseases characterized by extracellular deposition of amyloid fibrils in many different organs finally resulting in organ failure. Cardiac involvement is common for immunoglobulin light chain amyloidosis (AL) or transthyretin amyloidosis (ATTR); the latter is caused by a transthyretin gene variant or wild-type protein. Precise diagnostic assessment including laboratory tests, electrocardiography, echocardiography, cardiac magnetic resonance imaging, biopsy, and/or bone scintigraphy is mandatory for definition of the amyloid type and finally for treatment initiation. Treatment of cardiac amyloidosis includes symptomatic therapy of heart failure as well as the underlying disease. Causative treatment of AL amyloidosis is according to regimens used for multiple myeloma. For many years, orthotopic liver transplantation was the only treatment available for hereditary ATTR amyloidosis, but important advances have been made after approval of a novel class of medication, namely, RNA silencers. However, currently no treatment is available to remove amyloid deposited in the tissue. Thus, early diagnosis is still critical to afford the best efficacy of available therapies.",Kristen AV,Herz. 2020 May;45(3):267-271. doi: 10.1007/s00059-020-04904-4.,10.1007/s00059-020-04904-4 [pii]
Imaging modalities in cardiac amyloidosis.,"Cardiac amyloidosis (CA) is an infiltrative restrictive cardiomyopathy caused by the deposition of amyloid fibrils in the myocardium, presenting primarily as transthyretin cardiac amyloidosis (ATTR) and immunoglobulin light chain cardiac amyloidosis (AL). ATTR is further classified into wild-type (ATTRwt) and hereditary (ATTRv) based on transthyretin gene mutation. The disease is increasingly recognized as a significant cause of heart failure. Advances in diagnostic modalities, including electrocardiography, echocardiography, cardiac magnetic resonance imaging, and technetium pyrophosphate scintigraphy, have revolutionized the non-invasive diagnosis of CA. While ATTR can often be diagnosed with scintigraphy, AL typically requires histological confirmation. This review explores these diagnostic tools, emphasizing their role in early detection and quantification of disease burden, which are crucial for timely treatment and prognostication. This comprehensive overview aims to aid clinicians in efficiently diagnosing CA, ultimately improving patient outcomes.","Bashir Z, Musharraf M, Azam R, Bukhari S",Curr Probl Cardiol. 2024 Dec;49(12):102858. doi: 10.1016/j.cpcardiol.2024.102858. Epub 2024 Sep 19.,S0146-2806(24)00493-6 [pii]
'Valvular' AL amyloidosis.,No abstract available,"Jozsa C, Lloyd G, Bhattacharyya S",Eur Heart J. 2019 Dec 1;40(45):3717. doi: 10.1093/eurheartj/ehz534.,5541860 [pii]
Rare vertebral pathological fracture in primary amyloidosis.,"Spinal involvement in primary amyloidosis is an exceedingly rare condition, presenting with typical pathological fracture symptoms that are often indistinguishable from other pathologies such as bone metastasis, metabolic disorders and infections. Histopathological studies for tissue diagnosis are the cornerstone of a definitive diagnosis, leading to successful treatment. Early diagnosis and intervention play a pivotal role in the care of patients with amyloidosis. Here, we present a unique case of a pathological fracture in the L4 vertebra following minor trauma. This fracture manifested with pain, instability and limitations in daily activities in a patient who had already been diagnosed with systemic amyloidosis and was undergoing chemotherapy. This case represents a distinct instance of vertebral involvement in amyloidosis and was managed with both chemotherapy and surgical intervention to address the spinal pathology, resulting in favourable outcomes.","Norisyam Y, Zairul Anuar KB, Ohn KM, Moharzudi M",BMJ Case Rep. 2024 Feb 22;17(2):e258973. doi: 10.1136/bcr-2023-258973.,17/2/e258973 [pii]
"The evolving spectrum of kidney amyloidosis: advances in diagnosis, typing and treatment.","Kidney amyloidosis encompasses a spectrum of heterogeneous conditions in which damage is caused by the deposition of various misfolded proteins that aggregate into fibrils. The main form of renal amyloidosis in Western countries is immunoglobulin light chain (AL) amyloidosis, which is usually secondary to a plasma cell clone or less frequently a B-cell clone, while rarer causes include AA amyloidosis, ALECT2 and hereditary amyloidoses. The main renal manifestations include nephrotic syndrome and kidney dysfunction with modest or absent proteinuria. The course is progressive and renal and overall survival is reduced in many patients. While biopsies are usually positive by Congo Red staining in all types of amyloidosis, precise identification of the amyloid fibril protein is essential and is best achieved with immunohistochemistry or proteomic studies, such as mass spectrometry. This method also allows the discovery of novel amyloidogenic proteins and has contributed to expand the list of amyloid types. The current treatment strategy is based on suppressing new amyloid fibril production through chemotherapy in AL amyloidosis, control of inflammation in AA amyloidosis and 'gene silencing' therapies in hereditary forms, such as the one linked with transthyretin. Novel approaches aim at enhancing natural amyloid clearance in order to reduce the rate of organ failure. Kidney transplantation in patients who achieved response has shown outcomes comparable to the general transplant population. In this review, we present the key aspects of renal amyloidosis and discuss novel concepts in this evolving field.","Allinovi M, Trivioli G, Gaudio C, L'Imperio V, Rauf MU, Gillmore JD",Nephrol Dial Transplant. 2025 Sep 29;40(10):1826-1837. doi: 10.1093/ndt/gfaf042.,8043263 [pii]
Diagnostic Challenges and Solutions in Systemic Amyloidosis.,"Amyloidosis refers to a clinically heterogeneous group of disorders characterized by the extracellular deposition of amyloid proteins in various tissues of the body. To date, 42 different amyloid proteins that originate from normal precursor proteins and are associated with distinct clinical forms of amyloidosis have been described. Identification of the amyloid type is essential in clinical practice, since prognosis and treatment regimens both vary according to the particular amyloid disease. However, typing of amyloid protein is often challenging, especially in the two most common forms of amyloidosis, i.e., the immunoglobulin light chain amyloidosis and transthyretin amyloidosis. Diagnostic methodology is based on tissue examinations as well as on noninvasive techniques including serological and imaging studies. Tissue examinations vary depending on the tissue preparation mode, i.e., whether it is fresh-frozen or fixed, and they can be carried out by ample methodologies including immunohistochemistry, immunofluorescence, immunoelectron microscopy, Western blotting, and proteomic analysis. In this review, we summarize current methodological approaches used for the diagnosis of amyloidosis and discusses their utility, advantages, and limitations. Special attention is paid to the simplicity of the procedures and their availability in clinical diagnostic laboratories. Finally, we describe new methods recently developed by our team to overcome limitations existing in the standard assays used in common practice.","Goldis R, Kaplan B, Kukuy OL, Arad M, Magen H, Shavit-Stein E, Dori A, Livneh A",Int J Mol Sci. 2023 Feb 28;24(5):4655. doi: 10.3390/ijms24054655.,ijms24054655 [pii]
Successes in translation.,"Translational research is key in advancing the diagnosis and therapy of systemic amyloidoses. This paper summarises our presentations at the ISA Workshop on Translation in Systemic Amyloidoses held in Athens on September 25-26, 2023. The critical advances made by the pioneers in the field are reviewed, with particular attention to the discoveries and developments of utmost importance to our understanding of what amyloid is and how the substance affects functions. Examples of translational research regarding the mechanisms of cardiac damage in light chain amyloidosis, the role of biomarkers in improving our understanding of the biology of the disease and patients' management, and the molecular mechanisms involved in the cytotoxicity are described. Advances in basic research continue to open new therapeutic avenues.","Westermark P, Merlini G",Amyloid. 2024 Sep;31(3):159-167. doi: 10.1080/13506129.2024.2387163. Epub 2024 Aug 5.,10.1080/13506129.2024.2387163 [doi]
Acquired and Genetic Amyloid Neuropathies.,"Amyloidosis is a potentially treatable cause of polyneuropathy with various distinct etiologies, including amyloid light chain (AL), transthyretin variant (ATTRv), wild-type transthyretin amyloidosis (wrATTR), gelsolin, and apolipoprotein A1 (ApoA-I). Among these, AL and transthyretin amyloidosis are the most common, while AGel and ApoA-I amyloidosis present more complex diagnostic challenges due to their rarity. Despite advances in the recognition and treatment of AL and transthyretin amyloid protein amyloidosis, diagnostic delays remain a concern. Accurate diagnosis hinges on genetic testing, biomarker development, and tissue biopsy with Congo red staining. Multidisciplinary collaboration, including neurologists, is crucial for optimizing patient outcomes across all forms of amyloidosis.","Karam C, Pasnoor M, Barohn RJ, Dimachkie MM",Neurol Clin. 2025 Nov;43(4):837-849. doi: 10.1016/j.ncl.2025.05.016. Epub 2025 Jul 18.,S0733-8619(25)00035-0 [pii]
"Cardiac Amyloidosis: Overlooked, Underappreciated, and Treatable.","Cardiac amyloidosis (CA) is an infiltrative and restrictive cardiomyopathy that leads to heart failure, reduced quality of life, and death. The disease has two main subtypes, transthyretin cardiac amyloidosis (ATTR-CA) and immunoglobulin light chain cardiac amyloidosis (AL-CA), characterized by the nature of the infiltrating protein. ATTR-CA is further subdivided into wild-type (ATTRwt-CA) and variant (ATTRv-CA) based on the presence or absence of a mutation in the transthyretin gene. CA is significantly underdiagnosed and increasingly recognized as a cause of heart failure with preserved ejection fraction. Advances in diagnosis that employ nuclear scintigraphy to diagnose ATTR-CA without a biopsy and the emergence of effective treatments, including transthyretin stabilizers and silencers, have changed the landscape of this field and render early and accurate diagnosis critical. This review summarizes the epidemiology, pathophysiology, diagnosis, prognosis, and management of CA with an emphasis on the significance of recent developments and suggested future directions.","Rubin J, Maurer MS",Annu Rev Med. 2020 Jan 27;71:203-219. doi: 10.1146/annurev-med-052918-020140.,10.1146/annurev-med-052918-020140 [doi]
Fundamentals of Light Chain Cardiac Amyloidosis: A Focused Review.,"The estimated prevalence of AL CA in the US is approximately 8-12 cases per million. Almost 30-50% diagnosed cases of AL amyloid in the US have multisystem involvement, including cardiac involvement. Even with the availability of advanced diagnostic testing and novel therapies, prognosis remains poor. It is overlooked as a cause of heart failure with preserved ejection fraction leading to a delay in diagnosis when management options are limited and associated with poor survival outcomes. Therefore, the education of physicians is needed to ensure that it would be highly considered as a differential diagnosis. The purpose of this manuscript is to review the advances in the diagnosis and management of cardiac amyloidosis with the aim of educating colleagues who provide care in the primary care setting. We have summarized the pathogenesis of amyloidosis, its association with plasma cell dyscrasias, novel diagnostic and surveillance approaches including echocardiography, cardiovascular magnetic resonance imaging, histopathologic techniques, systemic biomarkers, and advanced treatment approaches including supportive symptomatic management and standard of care chemotherapy targeting the amyloid deposits. Given the overall poor prognosis of amyloidosis, we have also discussed the role of palliative and hospice care.","Latif A, Lateef N, Razzaq F, Kapoor V, Ahsan MJ, Ashfaq M, Iftikhar A, Anwer F, Holmberg M, William P",Cardiovasc Hematol Disord Drug Targets. 2020;20(4):274-283. doi: 10.2174/1871529X20666201130110036.,CHDDT-EPUB-111942 [pii]
