Title,Abstract,Authors,Journal,DOI
Echocardiographic phenotype for refined risk stratification and treatment selection in light chain amyloidosis with heart failure.,"AIMS: Light chain amyloidosis (AL) patients with heart failure (HF) are usually with revised Mayo (rMayo) stage III/IV disease and have a poor prognosis. We sought to investigate whether and what echocardiographic phenotype provides value for further risk stratification and guiding optimal risk-adapted treatment in this subgroup of AL patients. METHODS AND RESULTS: 95 AL patients who presented with HF and were on rMayo stage III/IV were retrospectively included. Of them, 51 patients (53.7%) were with stage III, 44 (46.3%) were with stage IV, and 44 (46.3%) underwent chemotherapy. Laboratory and echocardiographic measurements were acquired before the initiation of chemotherapy. The relevance of different variables with survival was assessed in the entire cohort, chemotherapy, and non-chemotherapy group. By Multivariate Cox regression analysis, right ventricular wall thickness (RVT) [HR 1.145, 95% confidence interval (CI) 1.026-1.279, P = 0.016], relative wall thickness (RWT) (HR 6.709, 95% CI 1.101-40.877, P = 0.039), and left ventricular ejection fraction (LVEF) < 50% (HR 1.939, 95% CI 1.048-3.590, P = 0.035) were found to be independently associated with survival in the entire cohort, RWT (HR 15.488, 95% CI 2.045-117.292, P = 0.008) in the non-chemotherapy group, and RVT (HR 1.331, 95% CI 1.054-1.681, P = 0.016) in the chemotherapy group, respectively. Kaplan-Meier survival analysis revealed that survival was significantly reduced in the presence of RVT ≥ 6.5 mm or LVEF < 50% in the entire cohort, and the significance of RVT ≥ 6.5 mm was irrespective of rMayo stages. In the chemotherapy group, survival was decreased if RVT ≥ 6.5 mm alone or together with RWT ≥ 0.67 were present, particularly in patients on rMayo stage IV. CONCLUSIONS: Echocardiographic phenotype provides incremental value beyond rMayo staging for predicting survival and could further guide treatment in advanced AL with HF. Those with high-risk echocardiographic phenotypes as higher RVT and RWT and lower LVEF had a worse prognosis.","Yang H, Li R, Ma F, Liu Y, He X, Yang Q, Wang DW, Zeng H, Wang H",J Cancer Res Clin Oncol. 2023 Sep;149(11):8415-8427. doi: 10.1007/s00432-023-04783-2. Epub 2023 Apr 21.,10.1007/s00432-023-04783-2 [pii]
Clinical and prognostic utility of cardiovascular magnetic resonance imaging in myeloma patients with suspected cardiac amyloidosis.,"OBJECTIVES: AL amyloidosis affects up to 30% of patients with multiple myeloma (MM), and cardiac involvement is associated with worse outcomes. Traditional screening modalities including EKG, echocardiography and biomarkers have limited value. The aim of this study was to evaluate the clinical and prognostic value of late gadolinium enhancement (LGE) by cardiovascular magnetic resonance (CMR) imaging in patients with plasma cell dyscrasias and suspected cardiac amyloidosis (CA). METHODS: A total of 251 consecutive patients with plasma cell dyscrasias who underwent CMR were enrolled in this study. Primary endpoint was all cause mortality. Clinical, ECG, echocardiographic, biomarker and CMR predictors of mortality were analyzed. RESULTS: Mean age of population was 63 ± 10 years, 36% females and 19% African Americans. During a median follow-up duration of 28 months (IQR 5-56), there were 97 deaths (39%). Patients who died were more likely to have diabetes (28% vs. 14%; P = 0.03), CAD (28% vs. 16%; P = 0.04) and CKD (33% vs. 21%; P = 0.04). With endomyocardial biopsy as the gold standard (42 (17%) patients), amyloid pattern on CMR (LGE+) had sensitivity and negative predictive values of 100%; specificity and positive predictive values of 80 and 81% with an AUC 0.9 for CA. History of CAD (HR 1.64, 95% CI 1.01-2.6; P = 0.04), brain natriuretic peptide (HR 1.0003 95% CI 1.0001-1.0006; P = 0.004) and LGE + (HR 1.72, 95% CI 1.05-2.8; P = 0.02) were independent predictors of mortality. LGE+ possessed incremental prognostic value over clinical, laboratory and echocardiographic variables for mortality prediction. CONCLUSIONS: CMR is a clinically useful tool for diagnosis and prognostication in myeloma patients with suspected CA.","Bhatti S, Watts E, Syed F, Vallurupalli S, Pandey T, Jambekar K, Mazur W, Hakeem A",Eur Heart J Cardiovasc Imaging. 2016 Sep;17(9):970-7. doi: 10.1093/ehjci/jew101. Epub 2016 May 25.,jew101 [pii]
Assessment of prognosis in immunoglobulin light chain amyloidosis patients with severe heart failure: a predictive value of right ventricular function.,"Although the benefit of updated therapeutic regimens, including bortezomib, on the survival of immunoglobulin light chain (AL) amyloidosis patients with heart failure (HF) has been reported, predictors of mortality in the patients treated with the updated therapy remain unclear. We retrospectively enrolled AL amyloidosis patients who had severe HF at the time of diagnosis and received the updated therapy, including bortezomib (n = 19, 61 ± 6 years old, 68% male). Severe HF was defined as the presence of both NYHA functional class III or IV and BNP > 200 pg/ml or NT-pro-BNP > 900 pg/ml. One-year mortality rate during follow-up after commencement of the treatment was 37%. Left ventricular morphological parameters and indexes of left ventricular diastolic function on admission were similar in the non-survivors and survivors. However, non-survivors had higher incidences of atrial fibrillation and ventricular tachycardia, higher serum total bilirubin levels (1.34 ± 0.55 vs. 0.61 ± 0.29 mg/dl), higher right atrial volume index (RAVI 49.7 ± 29.9 vs. 27.3 ± 6.8 ml/m(2)), lower tricuspid annular peak velocities during systole (RVs' 8.0 ± 1.8 vs. 11.6 ± 3.7 cm/sec) and late diastole (RVa' 3.4 ± 0.9 vs. 11.4 ± 5.3 cm/sec), and larger inferior vena cava dimension (22.7 ± 6.4 vs. 16.3 ± 4.9 mm) than those in survivors. Kaplan-Meier curve analyses showed that larger RAVI and lower RVs' and RVa', but not left ventricular systolic/diastolic dysfunction, predicted higher mortality during 1-year follow-up. The present results suggest that the presence of right-sided heart abnormality on admission is associated with high 1-year mortality in AL amyloidosis patients with severe HF under the updated therapeutic regimens.","Nagano N, Yano T, Fujita Y, Kouzu H, Koyama M, Ikeda H, Yasui K, Muranaka A, Nishikawa R, Takahashi R, Kishiue N, Yuda S, Miura T",Heart Vessels. 2020 Apr;35(4):521-530. doi: 10.1007/s00380-019-01513-y. Epub 2019 Sep 26.,10.1007/s00380-019-01513-y [pii]
Increased Prognostic Value of Query Amyloid Late Enhancement Score in Light-Chain Cardiac Amyloidosis.,"BACKGROUND: Late gadolinium enhancement (LGE) pattern is a powerful imaging biomarker for prognosis of cardiac amyloidosis. It is unknown if the query amyloid late enhancement (QALE) score in light-chain (AL) amyloidosis could provide increased prognostic value compared with LGE pattern. METHODS AND RESULTS: Seventy-eight consecutive patients with AL amyloidosis underwent contrast-enhanced cardiovascular magnetic resonance imaging. Patients with cardiac involvement were grouped by LGE pattern and analyzed using QALE score. Receiver operating characteristic curve was used to identify the optimal cut-off for QALE score in predicting all-cause mortality. Survival of these patients was analyzed with the Kaplan-Meier method and multivariate Cox regression. During a median follow-up of 34 months, 53 of 78 patients died. The optimal cut-off for QALE score to predict mortality at 12-month follow-up was 9.0. On multivariate Cox analysis, QALE score ≥9 (HR, 5.997; 95% CI: 2.665-13.497; P<0.001) and log N-terminal pro-brain natriuretic peptide (HR, 1.525; 95% CI: 1.112-2.092; P=0.009) were the only 2 independent predictors of all-cause mortality. On Kaplan-Meier analysis, patients with subendocardial LGE can be further risk stratified using QALE score ≥9. CONCLUSIONS: The QALE scoring system provides powerful independent prognostic value in AL cardiac amyloidosis. QALE score ≥9 has added value to differentiate prognosis in AL amyloidosis patients with a subendocardial LGE pattern.","Wan K, Sun J, Han Y, Liu H, Yang D, Li W, Wang J, Cheng W, Zhang Q, Zeng Z, Chen Y",Circ J. 2018 Feb 23;82(3):739-746. doi: 10.1253/circj.CJ-17-0464. Epub 2017 Nov 2.,10.1253/circj.CJ-17-0464 [doi]
"Bone marrow amyloid: a comprehensive analysis of 1,469 samples, including amyloid type, clinical features, and morphologic distribution.","BACKGROUND: Bone marrow biopsy is common in patients suspected of having systemic AL amyloidosis. However, little is known about the incidence, morphology and clinical phenotype of non-AL amyloid types in bone marrow. METHODS: We retrospectively identified N = 1469 bone marrow amyloid biopsies typed using a proteomics-based method between 2008-2020. Frequency of amyloid types (N = 1469), distribution of amyloid deposits (N = 139), and clinical phenotypes (N = 355), with particular emphasis on cardiac involvement, were assessed. RESULTS: The amyloid types were: AL (N = 1172; 79.8%), ATTR (N = 240; 16.3%), AH (N = 38; 2.6%), AA (N = 17; 1.2%), and Aβ2M (N = 2; 0.1%). Although there were characteristic morphologic features, including periosteal soft tissue and/or vascular involvement in ATTR, interstitial vascular involvement in AA, and variable anatomic compartment involvement in AL, none were pathognomonic. Most patients with both an M-spike and cardiac involvement had AL amyloid in their BM, but in over 10% the amyloid type was ATTR. Compared to AL patients, ATTR patients had higher stage cardiac amyloidosis and lower overall survival, which was mainly due to advanced cardiac stage. CONCLUSIONS: ATTR amyloid is common in bone marrow and its morphologic distribution overlaps with AL. Amyloid typing is critical as over 10% of patients with bone marrow amyloid, cardiac amyloidosis, and an M-spike have ATTR amyloidosis.","Chiu A, Dasari S, Kurtin PJ, Theis JD, Vrana JA, Dispenzieri A, Rech KL, Dao LN, Howard MT, Grogan M, McPhail ED",Amyloid. 2022 Sep;29(3):156-164. doi: 10.1080/13506129.2022.2031963. Epub 2022 Feb 9.,10.1080/13506129.2022.2031963 [doi]
Amyloid cardiomyopathy in a large integrated health care system.,"BACKGROUND: Light Chain (AL) and transthyretin (ATTR) amyloidosis are the most common forms of amyloid cardiomyopathy. Population based studies describing the epidemiology and clinical features of amyloid cardiomyopathy are often based in tertiary medical centers and thus may be limited by referral bias. METHODS AND RESULTS: We performed a cohort study of 198 patients diagnosed and treated in the Kaiser Permanente Northern California health care system who had a confirmed diagnosis of cardiac amyloidosis between 2001 and 2016. Associations between demographic, clinical, laboratory and imaging data and patient outcomes were quantified using multivariable Cox proportional hazard models for both the AL and ATTR groups. The average length of follow up was 2.8 years (SD 2.9 years) and overall survival was 69.1 percent at one year and 35.4 percent at five years. In the AL group, lower left ventricular ejection fraction (HR 1.33 per 5-point decrease, P < .001), coronary artery disease (HR 3.56, P < .001), and diabetes mellitus (HR 3.19, P < .001) were associated with all-cause mortality. Increasing age at the time of diagnosis with associated with higher all-cause mortality in both the AL and ATTR groups. Higher levels of B-type natriuretic peptide were associated with all-cause mortality in both groups: Top quartile BNP HR 6.17, P < .001 for AL and HR 8.16, P = .002 for ATTR. CONCLUSIONS: This study describes a large cohort of patients with amyloid cardiomyopathy derived from a community based, integrated healthcare system and describes demographic, clinical, and laboratory characteristics associated with mortality and heart failure hospitalization. In this population, coronary artery disease, diabetes mellitus, and high BNP levels were strongly associated with mortality.","Czobor P, Hung YY, Baer D, McGlothlin D, Weisshaar D, Zaroff J",Am Heart J. 2019 Oct;216:42-52. doi: 10.1016/j.ahj.2019.06.008. Epub 2019 Jun 20.,S0002-8703(19)30153-X [pii]
A Young Woman with an Acute Illness and Chest Pain.,No abstract available,"Karagiannis P, Trachtenberg BH",Methodist Debakey Cardiovasc J. 2018 Jan-Mar;14(1):e1.,N/A
Amino acid sequence homology of monoclonal serum free light chain dimers and tissue deposited light chains in AL amyloidosis: a pilot study.,"OBJECTIVES: Diagnosis of light chain amyloidosis (AL) requires demonstration of amyloid deposits in a tissue biopsy followed by appropriate typing. Previous studies demonstrated increased dimerization of monoclonal serum free light chains (FLCs) as a pathological feature of AL. To further examine the pathogenicity of FLC, we aimed at testing amino acid sequence homology between circulating and deposited light chains (LCs). METHODS: Matched tissue biopsy and serum of 10 AL patients were subjected to tissue proteomic amyloid typing and nephelometric FLC assay, respectively. Serum FLC monomers (M) and dimers (D) were analyzed by Western blotting (WB) and mass spectrometry (MS). RESULTS: WB of serum FLCs showed predominance of either κ or λ type, in agreement with the nephelometric assay data. Abnormal FLC M-D patterns typical of AL amyloidosis were demonstrated in 8 AL-λ patients and in one of two AL-κ patients: increased levels of monoclonal FLC dimers, high D/M ratio values of involved FLCs, and high ratios of involved to uninvolved dimeric FLCs. MS of serum FLC dimers showed predominant constant domain sequences, in concordance with the tissue proteomic amyloid typing. Most importantly, variable domain sequence homology between circulating and deposited LC species was demonstrated, mainly in AL-λ cases. CONCLUSIONS: This is the first study to demonstrate homology between circulating FLCs and tissue-deposited LCs in AL-λ amyloidosis. The applied methodology can facilitate studying the pathogenicity of circulating FLC dimers in AL amyloidosis. The study also highlights the potential of FLC monomer and dimer analysis as a non-invasive screening tool for this disease.","Goldis R, Kaplan B, Arad M, Dispenzieri A, Dasari S, Kukuy OL, Simon AJ, Dori A, Shavit-Stein E, Ziv T, Murray D, Kourelis T, Gertz MA, Dominissini D, Magen H, Muchtar E",Clin Chem Lab Med. 2023 Sep 26;62(3):464-471. doi: 10.1515/cclm-2023-0591. Print 2024 Feb 26.,cclm-2023-0591 [pii]
A 49-Year-Old Woman With Progressive Dyspnea.,No abstract available,"Dai HL, Zhang WH, Guang XF",JAMA Cardiol. 2022 Feb 1;7(2):e214920. doi: 10.1001/jamacardio.2021.4920. Epub 2022 Feb 9.,2788743 [pii]
Longitudinal strain is an independent predictor of survival and response to therapy in patients with systemic AL amyloidosis.,"AIMS: Cardiac involvement, a major determinant of prognosis in AL (light-chain immunoglobulin) amyloidosis, is characterized by an impairment of longitudinal strain (LS%). We sought to evaluate the utility of LS% in a prospectively observed series of patients. METHODS AND RESULTS: A total of 915 serial newly diagnosed AL patients with comprehensive baseline assessments, inclusive of echocardiography, were included. A total of 628/915 (68.6%) patients had cardiac involvement. The LS% worsened with advancing cardiac stage with mean -21.1%, -17.1%, -12.9%, and -12.1% for stages I, II, IIIa, and IIIb, respectively (P < 0.0001). There was a highly significant worsening of overall survival (OS) with worsening LS% quartile: LS% ≤-16.2%: 80 months, -16.1% to -12.2%: 36 [95% confidence interval (CI) 20.9-51.1] months, -12.1% to -9.1%: 22 (95% CI 9.1-34.9) months, and ≥-9.0%: 5 (95% CI 3.2-6.8) months (P < 0.0001). Improvement in LS% was seen at 12 months in patients achieving a haematological complete response (CR) (median improvement from -13.8% to -14.9% in those with CR and difference between involved and uninvolved light chain <10 mg/L). Strain improvement was associated with improved OS (median not reached at 53 months vs. 72 months in patients without strain improvement, P = 0.007). Patients achieving an LS% improvement and a standard N-terminal pro-brain natriuretic peptide-based cardiac response survived longer than those achieving a biomarker-based cardiac response alone (P < 0.0001). CONCLUSION: Baseline LS% is a functional marker that correlates with worsening cardiac involvement and is predictive of survival. Baseline LS% and an absolute improvement in LS% are useful additional measures of prognosis and response to therapy in cardiac AL amyloidosis, respectively.","Cohen OC, Ismael A, Pawarova B, Manwani R, Ravichandran S, Law S, Foard D, Petrie A, Ward S, Douglas B, Martinez-Naharro A, Chacko L, Quarta CC, Mahmood S, Sachchithanantham S, Lachmann HJ, Hawkins PN, Gillmore JD, Fontana M, Falk RH, Whelan CJ, Wechalekar AD",Eur Heart J. 2022 Jan 31;43(4):333-341. doi: 10.1093/eurheartj/ehab507.,6362539 [pii]
Association between the TAPSE to PASP ratio and short-term outcome in patients with light-chain cardiac amyloidosis.,"BACKGROUND: Amyloid light-chain cardiac amyloidosis (AL-CA) patients experiencing RV failure have a poorer prognosis. The echocardiographic ratio of tricuspid annular plane systolic excursion (TAPSE) to pulmonary arterial systolic pressure (PASP) serves as a non-invasive proxy for evaluating the coupling between the right ventricle (RV) and pulmonary circulation. The aim of this study was to assess the association between the TAPSE/PASP ratio and short-term outcome in patients with AL-CA. METHODS: Seventy-one patients diagnosed with AL-CA were enrolled in this retrospective cohort study.Short-term outcome was defined as 6-month all-cause mortality. Receiver operating characteristic (ROC), logistic regression, and Kaplan-Meier analysis were used in this study. RESULTS: Among seventy-one patients with AL-CA (mean age, 62 ± 8 years, 69% male), 17 (24%) died within the first 6 months (mean follow-up period 55 ± 48 days). Linear regression analysis indicated that the TAPSE/PASP ratio was correlated with RV global longitudinal strain (r = -0.655, p < 0.001), RV free wall thickness (r = -0.599, p < 0.001), and left atrial reservoir strain (r = 0.770, p < 0.001). The time-dependent ROC and the area under the curve (AUC) showed that the TAPSE/PASP ratio was a better predictor (AUC = 0.798; 95% confidence interval (CI): 0.677-0.929) of short-term outcome than TAPSE (AUC = 0.734; 95% CI: 0.585-0.882) and PASP (AUC: 0.730; 95% CI: 0.587-0.874). Multivariate logistic regression showed that patients with the worse TAPSE/PASP (< 0.47 mm/mmHg) and lower systolic blood pressure (< 100 mmHg) had the highest risk of dying. CONCLUSIONS: The TAPSE/PASP ratio is associated with the short-term outcome of patients with AL-CA. The combination of TAPSE/PASP ratio < 0.474 mmHg and SBP < 100 mmHg could identify the subgroup of patients with AL-CA at elevated risk of poor prognosis.","Yu F, Cui Y, Shi J, Wang L, Zhou Y, Ye T, Ye Z, Yang J, Wang X",Int J Cardiol. 2023 Sep 15;387:131108. doi: 10.1016/j.ijcard.2023.05.058. Epub 2023 Jun 10.,S0167-5273(23)00790-8 [pii]
Associations of Electrocardiographic Parameters with Left Ventricular Longitudinal Strain and Prognosis in Cardiac Light Chain Amyloidosis.,"A 12-lead ECG is a simple and less costly measure to assess cardiac amyloidosis and may reflect the infiltrative nature of cardiac amyloidosis and have prognostic value for predicting overall survival in patients with cardiac AL amyloidosis. Therefore, we investigated the associations of surface ECG parameters with left ventricular (LV) global longitudinal strain (GLS) and prognosis in patients with cardiac AL amyloidosis. We performed a multi-center, retrospective analysis of 102 biopsy-proven cardiac AL amyloidosis patients. Baseline studies included 12-lead surface ECG and echocardiography, with two-dimensional strain analysis performed within one month of diagnosis. From the Kaplan-Meier survival analysis, patients with prolonged QTc (≥483 msec) had significantly poorer survival. ECG scores were assigned according to presence of prolonged QTc (≥483 msec) and abnormal QRS axis, and the study participants were divided into three groups according to ECG score. Mean absolute value of LV GLS and regional LV longitudinal strain (LS) differed significantly among the three groups and decreased in a stepwise manner as ECG score increased. Log NT-proBNP increased in a stepwise manner as ECG score increased. Prolonged QTc (≥483 msec) and abnormal QRS axis showed significant incremental values in addition to the revised Mayo stage. The presence of prolonged QTc (≥483 msec) and abnormal QRS axis showed significant incremental values for overall mortality rates. In addition, ECG scores consisting of presence of prolonged QTc (≥483 msec), and abnormal QRS axis showed good association with longitudinal LV dysfunction and NT-proBNP. ECG finding may provide prognostic additional information regarding prognosis of AL amyloidosis with cardiac involvement.","Kim D, Lee GY, Choi JO, Kim K, Kim SJ, Jeon ES",Sci Rep. 2019 May 23;9(1):7746. doi: 10.1038/s41598-019-44245-9.,10.1038/s41598-019-44245-9 [pii]
Sex-related differences in clinical presentation and all-cause mortality in patients with cardiac transthyretin amyloidosis and light chain amyloidosis.,"We aimed to ascertain whether sex-related differences are relevant to clinical presentation, cardiac phenotype and all-cause mortality in different types of cardiac amyloidosis, a field still poorly investigated. Medical files from consecutive patients diagnosed with cardiac amyloidosis between 2000 and 2020, at Careggi University Hospital, were retrospectively evaluated. Over this period, 259 patients (12% females) were diagnosed with wild type transthyretin amyloidosis (wtATTR), 52 (25% females) with hereditary transthyretin amyloidosis (hATTR) and 143 (47% females) with light chain amyloidosis (AL). Women with wtATTR, compared to men, were significantly older at the time of diagnosis and showed higher National Amyloidosis Centre score, thicker normalized interventricular septum, higher diastolic dysfunction and worse right ventricular function. Females with hATTR and AL had lower normalized cardiac mass compared to men, otherwise, bio-humoral parameters, NYHA class, and ECG characteristics were similar. Comparing females and male with wtATTR, hATTR and AL, no differences in Kaplan-Meier curves for all-cause mortality were observed with regard to sex, p-value >0.05. In conclusion, we did not observe major differences in clinical expression related to sex in different types of cardiac amyloidosis: specifically, all-cause mortality was not affected. Nevertheless, women with wtATTR had echocardiographic signs of more advanced disease and higher NAC score at diagnosis suggesting a possible later recognition of disease compared to men.","Zampieri M, Argirò A, Allinovi M, Tassetti L, Zocchi C, Gabriele M, Andrei V, Fumagalli C, Di Mario C, Tomberli A, Olivotto I, Perfetto F, Cappelli F",Int J Cardiol. 2022 Mar 15;351:71-77. doi: 10.1016/j.ijcard.2021.12.048. Epub 2022 Jan 4.,S0167-5273(21)02051-9 [pii]
"Phenotypic, transcriptomic, and genomic features of clonal plasma cells in light-chain amyloidosis.","Immunoglobulin light-chain amyloidosis (AL) and multiple myeloma (MM) are 2 distinct monoclonal gammopathies that involve the same cellular compartment: clonal plasma cells (PCs). Despite the fact that knowledge about MM PC biology has significantly increased in the last decade, the same does not apply for AL. Here, we used an integrative phenotypic, molecular, and genomic approach to study clonal PCs from 24 newly diagnosed patients with AL. Through principal-component-analysis, we demonstrated highly overlapping phenotypic profiles between AL and both monoclonal gammopathy of undetermined significance and MM PCs. However, in contrast to MM, highly purified fluorescence-activated cell-sorted clonal PCs from AL (n = 9) showed almost normal transcriptome, with only 38 deregulated genes vs normal PCs; these included a few tumor-suppressor (CDH1, RCAN) and proapoptotic (GLIPR1, FAS) genes. Notwithstanding, clonal PCs in AL (n = 11) were genomically unstable, with a median of 9 copy number alterations (CNAs) per case, many of such CNAs being similar to those found in MM. Whole-exome sequencing (WES) performed in 5 AL patients revealed a median of 15 nonrecurrent mutations per case. Altogether, our results show that in the absence of a unifying mutation by WES, clonal PCs in AL display phenotypic and CNA profiles similar to MM, but their transcriptome is remarkably similar to that of normal PCs.","Paiva B, Martinez-Lopez J, Corchete LA, Sanchez-Vega B, Rapado I, Puig N, Barrio S, Sanchez ML, Alignani D, Lasa M, García de Coca A, Pardal E, Oriol A, Garcia ME, Escalante F, González-López TJ, Palomera L, Alonso J, Prosper F, Orfao A, Vidriales MB, Mateos MV, Lahuerta JJ, Gutierrez NC, San Miguel JF",Blood. 2016 Jun 16;127(24):3035-9. doi: 10.1182/blood-2015-10-673095. Epub 2016 Apr 11.,S0006-4971(20)34466-9 [pii]
